{
  "$schema": "duos-benefit-content/v1",
  "appliesTo": {
    "carrier": "humana"
  },
  "key": "meals",
  "vendor": "Humana Well Dine",
  "note": "Meals delivered after a hospital stay through Humana Well Dine.",
  "verification": "Verified against 2026 HumanaChoice SNP-DE H7617-076 SB (Humana-H7617076000SB26) / EOC (Humana-H7617076000EOC26). Re-verify per plan before extending claims beyond vendor identity. Quantities/frequency are EOC facts pending product approval."
}
